ano,posicao,escola,pontos,link,letra
1987,1,"Estação Primeira de Mangueira No reino das palavras, Carlos Drummond de Andrade L A",224.0,https://galeriadosamba.com.br/escolas-de-samba/estacao-primeira-de-mangueira/1987/,"Mangueira 
De mãos dadas com a poesia
Traz para os braços do povo
Este poeta genial
Carlos Drummond de Andrade
Sua obras são palavras
De um reino de verdade
Itabira
Em seus versos ele tanto exaltou
Com amor
Eis a minha verde e rosa
Cantando em verso e prosa
O que o poeta inspirou
 
É Dom Quixote, ô
É Zé Pereira
É Charlie Chaplin
No embalo da Mangueira
 
Olha as carrancas 
Do rio São Francisco
Rema, rema, remador
Primavera vem chegando
Inspirando o amor
O Rio toma forma de sambista
Como o artista imaginou
 
Na ilusão de um sonho
Achei
O elefante que eu imaginei"
1987,2,Mocidade Independente de Padre Miguel Tupinicópolis L A S,223.0,https://galeriadosamba.com.br/escolas-de-samba/mocidade-independente-de-padre-miguel/1987/,"Vejam
Quanta alegria vem aí
É uma cidade a sorrir
Parece que estou sonhando
Com tanta felicidade
Vendo a Mocidade desfilando
Contagiando a cidade
 
E a oca virou taba
A taba virou metrópole
Eis aqui a grande Tupinicópolis
 
Boate Saci
Shopping Boitatá
Chá do Raoni
Pó de guaraná
 
No comércio e na indústria
No trabalho e na diversão
 
É Tupi amando este chão
 
Até o lixo é um luxo
Quando é real
Tupi Cacique
Poder geral
Minha cidade. minha vida, minha canção
Faz mais verde meu coração
 
Laiá, laiá, laiá, laiá
Lá, lá laiá, lá, laia, lá"
1987,3,"Império Serrano Com a boca no mundo, quem não se comunica se trumbica L A",221.0,https://galeriadosamba.com.br/escolas-de-samba/imperio-serrano/1987/,"Se liga, ligação vai ser preciso
Aviso o verbo é comunicar
Caminha nem pestanejou
Como agente da passiva
Se comunicou
 
Vai pombo-correio
De permeio na imensidão
Voe e vá dizer ao meu amor
Que a saudade machucou o meu coração
 
Pregoa pregoeiro
O mercado é todo seu
Independência ou morte
Grito forte que valeu
Ô de casa! Olha o carteiro
É a carta de quem nunca lhe esqueceu
Jornal, jornaleiro, jornalista
Reportagem, entrevista
A imprensa em comunhão
Tudo em primeira mão
 
Alô, alô, alô, alô
Não se comunicou, dançou
 
A radiofusão está no ar
Seu sucesso é notório
Fez tanto artista popular
Novelas, programas de auditório
Indiscutivelmente é a era da televisão
O tão distante presente
Se faz presente, satisfaz nossa visão
Até a lua lá no céu
Nos chega via Embratel
 
Quem não comunica
Se trumbica e como fica
Fica na saudade fica"
1987,3,"Portela Adelaide, a pomba da paz L A",221.0,https://galeriadosamba.com.br/escolas-de-samba/portela/1987/,"Como se fosse magia
Nosso poeta alcançou
O afã da poesia
Foi aí que clareou
Clareou é do infinito
Oh ! Que tema tão bonito
Adelaide, a pomba da paz
Está escrito
 
Voa, voa, voa
Deixa a tristeza de lado
Voa, voa, voa
Vai levar o seu recado
 
Leia esse matutino
Vai mudar o seu destino
Disse o tucano falador
Preciso de um mensageiro
Que seja bem ligeiro
Que leve a paz aonde for
Pomba entre na floresta
Aproveite a hora é esta
De aliviar a sua dor
Ilumine a escuridão
Faz feliz o coração
De qualquer sofredor ôôô
São quatro letras que fazem sonhar
É o amor que se espalha no ar
Neste dia de folia
Sigam o exemplo dessa pomba
Desativem esta bomba
Pra ninguém se machucar
 
Amar é bom, amar é bom
É bom demais
É felicidade
É sinônimo de paz"
1987,4,Beija-Flor de Nilópolis As mágicas luzes da ribalta L A,219.0,https://galeriadosamba.com.br/escolas-de-samba/beija-flor-de-nilopolis/1987/,"Ao descerrar a cortina
O palco se ilumina
Tudo é brilho, luz e cor
Mergulhei na poesia
Drama, riso e fantasia
Num cenário multicor 
Surgiu de uma era distante
Esta arte fascinante
Que o mundo inteiro deslumbrou
Com encanto e magia
O teatro irradia
A mais pura emoção
E, hoje, esta beleza infinita
Acontece na Avenida
É a minha escola a sensação
E lá no céu
Uma estrela brilhou
Anunciando a alegria
Que a passarela contagia
Com beleza e esplendor
Para que chorar
O que passou
Lamentar perdidas ilusões
O meu povo vibra
Cheio de euforia
Extasiando os corações"
1987,4,Estácio de Sá O tititi do sapoti L A,219.0,https://galeriadosamba.com.br/escolas-de-samba/estacio-de-sa/1987/,"Que tititi é esse
Que vem da Sapucaí
Tá que tá danado
Tá cheirando a sapoti
Baila no céu a esperança
O cheiro doce e perfume
Vêm no ar
Olê, olê, olê
Vem de terra mexicana
Mandei buscar pra você
Sacode pra colher
Do pé que eu quero ver
Até o dia amanhecer
D. João achou bom
Depois que o sapoti saboreou
Deu pra Dona Leopoldina
A Corte se empapuçou
E mandou rapidamente
Espalhar no continente
Até o Oriente conheceu
E hoje no quintal da vida sou criança
Me dá que o sapoti é meu
Isso virou tutti-fruti
Tutti-multinacional
Virou goma de mascar
Roda pra lá e pra cá
Na boca do pessoal"
1987,5,Acadêmicos do Salgueiro E por que não? L A S,216.0,https://galeriadosamba.com.br/escolas-de-samba/academicos-do-salgueiro/1987/,"Se um dia o mundo acordar 
(E vai acordar) 
Verá, verá, verá 
Uma luz brilhando no horizonte 
E vai se transformar 
Verá que tudo pode acontecer 
Sorrir, sem nunca precisar chorar 
Virar... Um passarinho 
E fazer do mundo, e por que não 
Um belo ninho 
Venham ter felicidade
Salgueirando a humanidade
Amanhã
É raio de luz agora 
Vai a luta
O que deve ser teu será
O chapéu de palha
Quererê
Suor no rosto e um chão para viver
O paraíso está na terra
E por que não acreditar
É acabar com as guerras 
E vamos viver de amar"
1987,5,Unidos de Vila Isabel Raízes L A,216.0,https://galeriadosamba.com.br/escolas-de-samba/unidos-de-vila-isabel/1987/,"A Vila Isabel 
Incorporada de Maíra 
Se transforma em deus supremo 
Dos povos de raiz 
Da terra Kaapor 
O deus morava nas montanhas 
E fez filhos do chão 
Mas só deu vida para um 
No templo de Maíra 
Sete deusas de pedra 
Mas vida só pra uma destinada à Arapiá 
Querubim, Tapixi guardava a deusa para ele 
Que sonhava conhecer a natureza 
Então ele fugiu 
Da serra buscando emoções 
E se encontrou com a Mãe dos Peixes Numiá 
Por ela Arapiá sentiu paixão 
E quatro filhos Numiá gerou 
 
Verão, calor e luz
Outono, muita fartura
Inverno, beleza fria
Primavera, cores e flores
Para enfeitar o paraíso
 
Mas eclodiu a luta entre os dois amantes
Pelo poder universal
Vovô Maíra interferiu na luta
E atirou os dois pro ar
Pra lá no céu jamais poderem se enfrentar
 
Arapiá,
Guaraci bola de fogo
E Numiá
É Jaci bola de prata
 
E fez dos quatro netos governantes magistrais 
Surgindo assim as estações do ano..."
1987,6,Imperatriz Leopoldinense Estrela Dalva de Oliveira L A,203.0,https://galeriadosamba.com.br/escolas-de-samba/imperatriz-leopoldinense/1987/,"Zum zum zum... A bateria
Zum zum zum... É harmonia
Hoje é dia de festa
Hoje é dia de folia
 
Oh! Saudade ô
Hoje você é carnaval
No palco do amor
O teu papel é o esplendor ôô
A Estrela Dalva brilha,
E ilumina o meu sonhar
É a luz, é a poesia
É a vontade de cantar
 
Lá lá lá lauê
É carnaval, vou me perder
Lá lá lá lauê
Vem, meu amor, quero você
Bandeira Branca
Meu amor, eu peço paz
Vamos sambar,
Viver feliz e nada mais"
1987,7,São Clemente Capitães do Asfalto L A,197.0,https://galeriadosamba.com.br/escolas-de-samba/sao-clemente/1987/,"Pequenino, triste feito um cão sem dono
Tão cansado de viver e sofrer por aí perambulando
Não teve sorte, seu berço não foi de ouro
Seu pai não teve tesouro
É triste sua vida a vagar
 
Seu moço dê-me um trocado
Eu quero comer um pão
Sou menor abandonado
Nesse mundo de ilusão
 
Enquanto o filho do papai rico
Desfruta do bom e o bonito
Do dinheiro que o pai tem
Lá vai o menino pobrezinho
Que acorda bem cedinho
Pra vender bala no trem
Muitas vezes é abandonado
Sendo bem ou maltratado
Na camada Funabem,
Alo Brasil
Felicidade nunca existiu no Sam,
Se hoje ele é mal orientado
Será marginalizado
Nas manchetes de amanhã
 
A São Clemente
Lembrou do seu existir
Somos Capitães de Asfalto
Na Sapucaí"
1987,7,Unidos do Cabuçu Roberto Carlos na cidade da fantasia L A,197.0,https://galeriadosamba.com.br/escolas-de-samba/unidos-do-cabucu/1987/,"Surgia na manhã o rei sol
Na carruagem que corria o infinito
Apolo dedilhava sua lira
Soavam notas que tocaram a tez de um mortal
Assim nasceu Roberto Carlos na canção popular
E hoje em festa e fantasia
Na corte da alegria vem cantar 
 
E quem sou eu, nessa cidade encantada
Sou mensageiro do amor
No esplendor da madrugada
 
Olha, você sabe muito bem
Certo Detalhes de uma vida agitada
O que me vale é a palavra amiga
Sempre tão querida do meu camarada
Um Amante à Moda Antiga
Nesse palco de Emoções
Quero que um amor seja eterno
O resto Que Vá Tudo Pro Inferno
 
Oh! Meu Brasil verde e amarelo
Meu Cachoeiro de luar tão belo
 
Oh! Noite, não se vá sem levar
De presente meu coração
Quem sabe nessa longa Cavalgada
No meu alazão de prata
Eu encontrei inspiração
E cantar pra você outra vez
A nossa canção...  Surgia"
1987,8,Caprichosos de Pilares Ajoelhou tem que rezar... ou Eu prometo L A,196.0,https://galeriadosamba.com.br/escolas-de-samba/caprichosos-de-pilares/1987/,"Estou cansado de ser enganado 
Papo furado é demagogia 
Não vão encher (o quê ?) 
A minha barriga vazia 
Espero da constituinte 
Em minha mesa muito pão 
Uma poupança cheia de cruzados 
E um carnaval com muita paz no coração 
Vou deitar, rolar
Pular feliz
Essa é a vida
Que eu sempre quis
Vamos, meu povo 
Democracia é participar 
Vote, cante, grite 
É tempo de mudar 
Quem vive de promessa é santo 
E eu não sou santo, meu senhor 
Seu deputado, eu votei 
E agora posso exigir 
Quero ver você cumprir 
Seu lero lero, blá, blá, blá 
Conversa mole isso aí 
É papo pra boi dormir 
Ajoelhou, tem que rezar
Não quero mais viver de ilusão
Você prometeu
Agora vai ter que pagar
Não vai me deixar na mão"
1987,9,União da Ilha do Governador Extra! Extra! L A,190.0,https://galeriadosamba.com.br/escolas-de-samba/uniao-da-ilha-do-governador/1987/,"Amor, acorda pra folia
Vem descobre o dia a dia
Novamente cruza o mar a alegria
Caminha mandou foi de cocheira,
Foi notícia de primeira
Seu Cabral! Que legal!
 
Olha eu aí olha eu aí
Vim botar ""a banca""
Na Sapucaí
 
Li que a missão do ""economês"" é exportar
Diz a manchete que a guerra vai acabar
Aqui na terra tem cruzado pra valer
Caderno B o dia D é luxo só
É bafafá, é ti-ti-ti no ta-ta-tá
Olha a dica, vai na boa
Que o astral vai melhorar
 
Dançou, dançou, dançou, dançou
Deu milonga nessa copa
Dona Zebra até dançou
 
Quem tem amor pode dar
Quem não tem vai achar
Quem tem, ama
Você é chama do meu coração
 
Oi! Brilha a emoção
Antes que eu ma esqueça
Extra! Extra! Deu Ilha na cabeça"
1987,10,Unidos da Ponte G.R.E.S. Saudade L A,188.0,https://galeriadosamba.com.br/escolas-de-samba/unidos-da-ponte/1987/,"O canto que encanta espanta
Os males que a vida nos traz
Saudade lembrança é herança
Dos antigos carnavais
Saudade que bate constante
Tão forte dentro do meu coração
O céu está engalanado
O chão todo enfeitado
De recordação
 
Quero o tempo parado
E poder reviver
Meu antepassado
Meu carnaval é você
 
Que beleza
A natureza traz de volta
O meu cantar
O arco-íris se transforma
Em passarela
E a ponte é  a tela
Da glória em seu despertar
 
No gingado da baiana
Dança o sol
E dança a lua
Também dança a velha-guarda
E a vida continua"
1987,11,"Unidos do Jacarezinho Lupicínio Rodrigues, a dor de cotovelo L A",170.0,https://galeriadosamba.com.br/escolas-de-samba/unidos-do-jacarezinho/1987/,"Entra meu amor fique a vontade
Para homenagear
O grande artista e poeta popular
Que se faz vestir de rosa e branco 
É por aqui a vida e obra de lupi
De bar em bar
E de amores em amores
Teceu canções
E fez da mágoa uma fonte de prazer
Semeando ao som de melodias
Alegria e prazer, eis a lição
Haja coração
Desafiando o tempo
E atravessando gerações
Suas canções vão encantando
Nos cabarés e salões
Uma legião de sofredores
Falando em desamor numa só voz 
Vira um mutirão de sonhadores
Semeando flores entre nós
Quem ontem chorou
Hoje vai sorrir
Lupiciniando na Sapucaí"
1987,12,Império da Tijuca Viva o povo brasileiro L A,152.0,https://galeriadosamba.com.br/escolas-de-samba/imperio-da-tijuca/1987/,"Tudo que vamos contar veio de lá da Itaparica
Ilha baiana onde viveu Pirapuama
E os personagens que ilustram essa trama
Dafé, Patrício Macário
E a mística figura do cenário
Ao passar pela Bahia os holandeses
Deixaram gerações, marcaram corações
E tem mais o barão cruel, homem dominador
Do monopólio da baleia era o senhor
 
Ôôôôôôô
Ôôôôôôô
 
No verde esperança dos olhos de Maria Luzia
A fé de um povo que sofria
Com ele lutou pelo ideal
De liberdade e justiça social
Após a vitória, coberta de glória
Tomada de emoção
Aprisiona o vencido, com sua doçura
Nas grades do seu coração
No Paraguai, vitória geral
Mas pro Macário, desilusão total
Ressoam novamente os atabaques 
Agradecendo aos nossos orixás
Lá se foi o general, fim da linha
Hoje ainda existe a canastra
A irmandade da casa da farinha
Por trás desta alegria, à sombra de uma dor, de uma dor
De um povo hospitaleiro
Viva nós, viva nós, viva o povo brasileiro"
1988,1,"Unidos de Vila Isabel Kizomba, festa da raça L A S",224.0,https://galeriadosamba.com.br/escolas-de-samba/unidos-de-vila-isabel/1988/,"Valeu Zumbi !
O grito forte dos Palmares
Que correu terras, céus e mares
Influenciando a abolição
Zumbi valeu !
Hoje a Vila é Kizomba
É batuque, canto e dança
Jongo e maracatu
 
Vem menininha pra dançar o caxambu
 
Ôô, ôô, Nega Mina
Anastácia não se deixou escravizar
Ôô, ôô Clementina
O pagode é o partido popular
O sacerdote ergue a taça
Convocando toda a massa
Neste evento que congraça
Gente de todas as raças
Numa mesma emoção
 
Esta Kizomba é nossa Constituição 
 
Que magia
Reza, ajeum e orixás
Tem a força da cultura
Tem a arte e a bravura
E um bom jogo de cintura
Faz valer seus ideais
E a beleza pura dos seus rituais
 
Vem a lua de Luanda
Para iluminar a rua
Nossa sede é nossa sede
De que o ""apartheid"" se destrua"
1988,2,"Estação Primeira de Mangueira 100 anos de liberdade, realidade ou ilusão? L A S",223.0,https://galeriadosamba.com.br/escolas-de-samba/estacao-primeira-de-mangueira/1988/,"Será ...
Que já raiou a liberdade
Ou se foi tudo ilusão
Será ...
Que a Lei Áurea tão sonhada
Há tanto tempo assinada
Não foi o fim da escravidão
Hoje dentro da realidade
Onde está a liberdade
Onde está que ninguém viu
Moço
Não se esqueça que o negro também construiu
As riquezas de nosso Brasil
 
Pergunte ao Criador
Quem pintou esta aquarela
Livre do açoite da senzala
Preso na miséria da favela
 
Sonhei ...
Que Zumbi dos Palmares voltou
A tristeza do negro acabou
Foi uma nova redenção
Senhor ...
Eis a luta do bem contra o mal
Que tanto sangue derramou
Contra o preconceito racial
 
O negro samba
Negro joga capoeira
Ele é o rei na verde e rosa da Mangueira"
1988,3,"Beija-Flor de Nilópolis Sou negro, do Egito à liberdade L A",222.0,https://galeriadosamba.com.br/escolas-de-samba/beija-flor-de-nilopolis/1988/,"Vem, amor, contar agora
Os cem anos da libertação
A história e a arte dos negros escravos
Que viveram em grande aflição
E mesmo lá no fundo das províncias do Sudão
Foram o braço forte da nação
Eu sou negro, e hoje enfrento a realidade
E abraçado à Beija-Flor, meu amor
Reclamo a verdadeira liberdade
Raiou o sol, e veio a lua
Eu sou negro, fui escravo
E a vida continua
Liberdade raiou, mas igualdade não, não, não, não
Resgatando a cultura
O grande negro revestiu-se de emoção
Ih! A mãe negra 
Oh! Mãe negra faz a festa
O povão se manifesta
Cantando para o mundo inteiro ouvir
Se faz presente a força de uma raça
Que pisa forte na Sapucaí
Dunga Tara Sinherê
Erê rê rê rê
Erê rê rê rê"
1988,4,Acadêmicos do Salgueiro Em busca do ouro L A S,219.0,https://galeriadosamba.com.br/escolas-de-samba/academicos-do-salgueiro/1988/,"Minha fantasia vale ouro 
Meu tesouro se espalha na avenida 
Vem de Midas o exemplo 
Esta ambição antiga 
Negros de ofícios e artistas 
Fizeram do barroco opção 
Xangô todo banhado em ouro? Chico Rei 
Na festa da libertação
A saga da lavoura do café... é 
A viga mestra da falida economia 
É festa, sinhazinha, vem dançar 
Os feitores vão chegar 
Juntos com a fidalguia 
Bantô... D'Angolô... Crioulo, muito axé...
Eis o milagre do café
Um dia na Bahia apareceu 
Cascatas de ouro negro 
Meu mando entregando o que é seu 
Em troca, presente grego 
Interesses ocultos 
O sangue da terra sugou 
Baianas, Monteiro Lobato 
Herói literato 
O petróleo salvou 
E hoje do ouro de fato 
O sonho dourado foi o que restou 
Serra pelada já está nua 
Mas minha alegria continua 
Nem de ouro nem de prata
O cruzado tanto fez que virou lata"
1988,5,"Portela Na lenda carioca, os sonhos do vice-rei L A",211.0,https://galeriadosamba.com.br/escolas-de-samba/portela/1988/,"Está fazendo um centenário
A Portela em louvação
Voa com a liberdade,
A águia e o negro
Num só coração.
Tece versos de amor
Que o vice-rei sonhou
Nesse cenário de paixão
A hora é essa
De irmanar a multidão
 
Canta meu povo, canta meu povo
Vem no embalo que a lenda é carioca
Canta meu povo,
Vem sambar de novo
 
Peripécias do amor
Que o vice-rei sofreu
Foi Vicente quem casou
O sonho se acabou
Susana,
Musa desse mar de lama,
Simplesmente a tua chama
Queima o peito de quem ama.
Valentim, foi ele sim, sim
Que esculpiu a fonte dos amores
Recanto tão sutil
 
Briga, eu, eu quero briga
Hoje eu venho reclamar
Essa praça ainda é minha
Eu também estou fominha
Jacaré vem me abraçar"
1988,6,União da Ilha do Governador Aquarilha do Brasil L A,210.0,https://galeriadosamba.com.br/escolas-de-samba/uniao-da-ilha-do-governador/1988/,"Saudade, só deixou saudade
Pra ser mais um dos menestréis
Vem na cegonha pra ver
Ari Barroso, o tema é você
Na velha época nasceu em Ubá
O menino iluminado
Hoje atravessa o mar
Com a milha Ilha
Nessa aquarilha do Brasil
Marcou gerações, ligou corações
E o povo ainda canta as suas canções
Tia Ritinha foi ela
Que abriu as portas 
Pra seu caminhar
Ô dá nela, machucou meu coração
Ô Maria, na palma da minha mão
Vai cantar o que? Calouro
Morena da boca de ouro
 
Quindim gostoso, quem vai provar
No tabuleiro de Iaiá
 
Boneca de piche, faceira, grau dez
Trabalha, trabalha, nego
Alô amigos, Zé cariocou
Divina musa
Sua voz maior no exterior
A gaitinha tocando... É gol
A galera vibrando... Mengo
 
Na homenagem veio a paz, a emoção
Milha Ilha risque agora
A saudade nesse chão"
1988,7,"Império Serrano Pára com isto, dá cá o meu L A S",208.0,https://galeriadosamba.com.br/escolas-de-samba/imperio-serrano/1988/,"O Rio não é mais como era antes
Pois acabaram com a nossa Guanabara
Fundiram toda a nossa competência
E já não somos a cidade Jóia Rara
Que saudades que eu tenho
Da bandeira com golfinhos e brasão
Do nosso Rio antigo
Praça Onze, onde o samba tinha abrigo
Rio, grande centro cultural
Patrimônio da riqueza nacional
Dá cá o meu
Dá cá o meu
O povo carioca
Cobra aquilo que perdeu
Quero novamente ver meu Rio
Dono do samba e do grande futebol
Ter um forte banco aqui na praça
E que não seja um comitê eleitoral
Chega de ter nossa casa comandada
Por malandro e coisa e tal
O Rio é negro e negro luta pelo Rio
Buscando a liberdade, enfrentando desafio
O Rio é negro e é negra essa nação
Vamos firme nessa luta
Proclamando a abolição"
1988,8,"Caprichosos de Pilares Luz, câmera e ação L A",207.0,https://galeriadosamba.com.br/escolas-de-samba/caprichosos-de-pilares/1988/,"Amor, ai amor,
O vento levou
Por toda a parte
As maravilhas
Da sétima arte
Lá vou eu, lá vou eu 
Curtindo os bastidores
Descobrindo este universo
Tintim por tintim
Ô Iaiá, seu vaga-lume, por favor
Quero um cantinho
Escondidinho pra ficar com meu amor
 
Filme proibido pra menor, xi!
Só pornografia
O cangaço
Abriu espaço pro cinema do Brasil
Ó quanta saudade
Do romantismo na tela
Com sutileza
O desenho animado surgiu
Tem comédia, tem piada
Musical com batucada
E no velho oeste eu vi
O nordeste em ação
Ai, coração
Vejam só
Toda filmagem reunida
Câmeras na festa colorida
Ação, luz e cor"
1988,8,"Mocidade Independente de Padre Miguel Beijim, beijim, bye bye Brasil L A",207.0,https://galeriadosamba.com.br/escolas-de-samba/mocidade-independente-de-padre-miguel/1988/,"Bye bye Brasil, beijim beijim)  BIS
Encanta a Mocidade assim)
E canta a Mocidade
A constituinte independente
Dividiu a nação naufragada
Em sete brasiléias encantadas
O progresso despontou
O cruzeiro se valorizou
E hoje nem saudades
Daquele Brasil devedor ... que ficou
Tchau, cruzado, inflação
Violência, marajás, corrupção
Adeus à dengue e a hiena-leão
A era nuclear, usina Rio-Mar
Itapõa, Iracema, iguarias de Itamaracá
E bate-papo de maracujá
Paulo Afonso, Juazeiro
Padinciço, Petrolina que reluz
Pedras preciosas, mulatas gol gay
Vinho enlatado e o gado revoltado
Chimarrão como exportei
O ouro de Serra Pelada
O P.I. como gritava
Rock outra vez
Divinamente, o salvador surgiu
Dando um toque diferente
Alô ... bye bye Brasil"
1988,8,"Tradição O melhor da raça, o melhor do carnaval L A",207.0,https://galeriadosamba.com.br/escolas-de-samba/tradicao/1988/,"Vem meu amor
Do teu coração abre a janela
Conquistando a passarela
Com saudades da Portela
Vem de novo a Tradição
Vem mostrar um pouco da aquarela
Que o Brasil tem no coração
 
Tem Deus Tupã, tem boitatá, tem Guaracy
Tem o Quarup e as danças de guerra
Tem Sapain, tem Aritana e Raoni
Lutando ainda pela posse da terra
 
Tem Carimbó, tem Caxambu, tem Ticumbi
Maracatus e jongos
Tem Chico Rei, Mãe Quelé, tem Zumbi
Regando até hoje a semente dos quilombos
 
Quem faz a festa é o Chalaça
O imperador vai gostar
Vai ter seresta e cachaça
Mucama vai se enfeitar
Salve a mistura da raça
Que nunca vai se acabar
Até o dia de Graça chegar
 
Vem, acende a chama
Da nossa história
Vamos exaltar a escola de samba
Nosso panteon de glória
 
Vem, me dê a mão
Que na folia é todo mundo igual
Vem, vem cantar junto com a Tradição
O melhor do carnaval"
1988,9,Estácio de Sá O boi dá bode L A S,204.0,https://galeriadosamba.com.br/escolas-de-samba/estacio-de-sa/1988/,"A onda que me levou
Me embalou de lá pra cá numa legal
E o vento que soprou
Me avisou que tinha boi no carnaval
Procurei
E achei o boi ""Ápis"", o boi dourado
A minha fantasia
E também o Minotauro
O boi grego da mitologia
Lá no norte dancei
O “boi bumbá bumbá”, meu boi
Lá pras bandas do Ceará
Em Pernambuco ouvi contar
Que “Maurício de Nassau”
Por uma ponte fez o boi voar
Foi 171 que enganou o pessoal
No compasso, oi
Joguei o laço pra pegar o boi
Que fracasso, que fracasso
Não sei pra onde o mandingueiro foi
Se matar esse boi, o mocotó é meu
Pra pagar a corrida
Que esse boi me deu
Tem boi no pasto e de presépio
Boicote em qualquer lugar
E o boi da ""cara preta""
Que fez careta pra me assustar
O boi de corte virou vaca
A carne é fraca, é isso aí
O boi dá bode na Sapucaí"
1988,10,São Clemente Quem avisa amigo é L A,197.0,https://galeriadosamba.com.br/escolas-de-samba/sao-clemente/1988/,"Desponta na avenida ""nova mente""
Mais uma vez vou cantar com altivez
Ora!  Tenha a santa paciência
Por que tanta violência
Nosso mundo está sofrendo
A fauna e a flora em extinção
Ainda temos esperança
De encontrar a solução
Nosso índio perde a terra
E é massacrado
Negro sofreu com a escravidão
Sonhava chegar o dia da libertação
Mulher ...  Lute pelos seus direitos
O tabu da virgindade
Já foi desfeito
Crianças encantadas com o ""He-man""
Desconhecem as maldades
Que em nossa terra tem 
O nordeste tão sofrido e sem amparo
Cidade grande, a polícia e o ladrão
Se defendem contra o monstro da inflação
Liberdade ...  Quero mudar
O meu canal para outro mundo
Onde não existe guerra
Nem tampouco marajás
E a paz se faz reinar
Se essa onda pega
Vá pegar noutro lugar
""Quem avisa amigo é""
São Clemente vai passar"
1988,11,Unidos da Tijuca Templo do absurdo - Bar Brasil L A,194.0,https://galeriadosamba.com.br/escolas-de-samba/unidos-da-tijuca/1988/,"Brasil... Bar Brasil
Berços das grandes resoluções
Pra quem se queixa que dá um duro danado
E é mal remunerado
Pro revoltado com as broncas do patrão
Ai, quem me dera eu fosse um marajá
Ganhasse a vida sem precisar trabalhar
Mas acontece que é só a minoria
Que desfruta a mordomia nessa tal democracia
 
Apertaram o gatilho num salário baleado
Outra piada depois desse tal cruzado
E segue o tormento
""Congelaumento""... É o preço da alimentação
O medo de sair, ser assaltado
E o plano mal traçado
A bomba que estourou em nossas mãos
As brigas com a patroa em casa
E o time que só faz perder
Não dá pra segurar, já chega de sofrer
Quero poder bebemorar
 
Eta papo pra rolar
No templo do debate popular
Pobres e ricos falam da dívida externa
Dos problemas desta terra
E se perguntam onde a coisa vai parar"
1988,12,Unidos da Ponte O bem amado Paulo Gracindo L A,190.0,https://galeriadosamba.com.br/escolas-de-samba/unidos-da-ponte/1988/,"Eu sou rei
Sedento de emoção
No trajetória de um astro
Eu sou personagem
Herói ou vilão
Na novela amor, amor, amor
Chega a emocionar
Na comédia
No palco da alegria
Faz meu povo gargalhar
Os anos dourados voltaram
A Nacional está no ar, no ar, no ar
Sucupira está em festa
Odorico Bem Amado
Vai ""genipapear""
Segue a arte
Em busca da perfeição
Paulo Gracindo é presente
Hoje estréia em grande gala
No teatro da ilusão
Eu queria eu queria meu cantar, meu cantar
Esperança brasileira
Que a brisa ligeira
Embala no ar"
