ano,posicao,escola,pontos,link,letra
1968,1,"Estação Primeira de Mangueira Samba, festa de um povo L A",125.0,https://galeriadosamba.com.br/escolas-de-samba/estacao-primeira-de-mangueira/1968/,"Quando uma luz divinal
Iluminava a imaginação
De um escritor genial
Tudo era maravilha
Tudo era sedução
Quanta alegria
E fascinação
Relembro
Aquele mundo encantado
Fantasiado de dourado
Oh doce ilusão
Sublime relicário de criança
Que ainda guardo como herança
No meu coração 
Glórias a este grande sonhador
Que o mundo inteiro deslumbrou
Com suas obras imortais
Vejam quanta riqueza exuberante
Na escritura emocionante
Com seus contos triunfais
Os seus personagens fascinantes
Nas estórias tão vibrantes 
Da literatura infantil
Enriquecem o cenário do Brasil
E assim ...
Neste cenário de real valor
Eis o mundo encantado
Que Monteiro Lobato criou"
1968,2,"Império Serrano Pernambuco, Leão do Norte L A",119.0,https://galeriadosamba.com.br/escolas-de-samba/imperio-serrano/1968/,"Esta admirável página
Que o passado deixou
Enaltece a nossa raça
Disse um famoso escritor
Que Maurício de Nassau
Na verdade foi um invasor 
Muito genial
Glória a Vidal de Negreiros
E aos seus companheiros
Que na luta contra os holandeses
Em defesa ao Leão do Norte
Arriscaram suas vidas
Preferiram a morte
Na trégua dos Guararapes
Teatro triste da insurreição
Houve estiagem, coragem, abnegação
Pernambuco hoje
É orgulho da federação
Evocando os Palmares
Terra de Bamboriki
Ainda ouço pelos ares
O retumbante grito do Zumbi
Lá rá rá rá rá rá
Lá rá rá rá rá rá rá"
1968,3,"Acadêmicos do Salgueiro Dona Beja, a feiticeira de Araxá L A",112.0,https://galeriadosamba.com.br/escolas-de-samba/academicos-do-salgueiro/1968/,"Certa jovem linda, divinal
Seduziu com seus encantos de menina 
O Ouvidor Real
Levada a trocar de roupagem
Numa nova linhagem 
Ela foi debutar
Na Corte, fascinou toda a nobreza 
Com seu porte de princesa 
Com seu jeito singular
Ana Jacinta, rainha das flores
Dos grandes amores
Dos salões reais
Com seus encantos e sua influência
Supera as intrigas 
Os preconceitos sociais
Era tão linda, tão meiga, tão bela
Ninguém mais formosa que ela 
No reino daquele ouvidor
Ela com seu feitiço inteligente 
Cria um reinado diferente 
Na corte de Araxá
E nos devaneios das festas de Jatobá
Mas antes, com seu trejeito feiticeiro 
Traz o Triângulo Mineiro 
De volta a Minas Gerais
Até o fim da vida
Dona Beja ouviu falar
Viu seu nome figurar
Na história de Araxá"
1968,4,Portela O tronco do ipê L A,103.0,https://galeriadosamba.com.br/escolas-de-samba/portela/1968/,"Apresentamos neste carnaval
Esta estória exuberante 
Cheia de trechos sensacionais
De episódios eletrizantes
 
Escrita por José de Alencar
Grande vulto de valor excepcional
O orgulho da literatura nacional
 
Tronco do Ipê
É o ponto culminante desta estória
Onde o pai Benedito fazia feitiçaria
Reunia os escravos no local
E lá fazia um batuque infernal !
 
Muito importante e também de emoção
Foi quando Alice caiu no boqueirão
Mário num esforço sobrenatural
Consumou a sua salvação
 
Outro fato bem marcante
Foi a carta testamento do barão
E a passagem mais bela
Foi o casamento de Mário e Alice na capela
Ô ô ô
 
Oh! Que maravilha!
Na casa grande
Todos dançando a quadrilha"
1968,5,Unidos de Lucas História do negro no Brasil ou Sublime pergaminho L A,99.0,https://galeriadosamba.com.br/escolas-de-samba/unidos-de-lucas/1968/,"Quando o navio negreiro
Transportava os negros africanos
Para o rincão brasileiro
Iludidos com quinquilharias
Os negros não sabiam
Ser apenas sedução
Para serem armazenados
E vendidos como escravos
Na mais cruel traição
Formavam irmandades
Em grande união
Daí nasceram os festejos
Que alimentavam os desejos de libertação
Era grande o suplício
Pagavam com sacrifício
A insubordinação
E de repente uma lei surgiu
Que os filhos dos escravos
Não seriam mais escravos do Brasil
Mais tarde raiou a liberdade
Daqueles que completassem
Sessenta anos de idade
O sublime pergaminho
Libertação geral
A princesa chorou ao receber
A rosa de ouro papal
Uma chuva de flores cobriu o salão
E um negro jornalista
De joelhos beijou a sua mão
Uma voz na varanda do Paço ecoou)
Meu Deus, meu Deus)  BIS
Está extinta a escravidão)"
1968,6,Mocidade Independente de Padre Miguel Viagem pitoresca através do Brasil L A,82.0,https://galeriadosamba.com.br/escolas-de-samba/mocidade-independente-de-padre-miguel/1968/,"Ao rever a história
Que Maurício Rugendas deixou
Eu destaquei na memória
Essa página de glória
Muito importante e tão viril
Viagens Pitorescas
Através do Brasil
As nossas praias sem iguais
Interrompidas por rochedos colossais
E as matas verdejantes
Onde existiam vários animais
Rugendas observou essa beleza
Ao contemplar a natureza
Caminhando por esse Brasil afora
Entusiasmado Rugendas catalogou
As cenas tristes e alegres
Nos idos tempos do Brasil Imperial
Glórias...
A esta bela viagem sua
Pois existem até hoje em Munique
Lindos quadros retratados em pinturas
Ainda dentro do seu roteiro
Luta e lamentos de raça
Rugendas anotou
Com orgulho o nosso povo brasileiro
E a mulata
Com seu feitiço e beleza
Era disputada a peso de ouro
Pela mais alta nobreza
Eu revi na minha música a memória
Estas páginas de glória
Que Rugendas deixou
No lindo berço de sua história "
1968,7,Estácio de Sá Uma visita ao Museu Imperial L A,79.0,https://galeriadosamba.com.br/escolas-de-samba/estacio-de-sa/1968/,"Guardei a mais bela recordação
Promovida à inspiração ao ver
Uma obra monumental e neste samba,
Meu mensageiro feliz
Lembro a visita que fiz
Ao Museu Imperial e no conviver
De tanta beleza no requinte,
A riqueza, do majestoso cenário
Encerra passagem da nossa história
Todo o passado de glória
Deste exuberante relicário
Então, ergue sua voz o trovador
Para exaltar com muito amor
O rico manancial revive
Na singela melodia
O fausto da monarquia
Da família imperial relembro
As jóias maravilhosas,
Carruagens majestosas,
O manto e a coroa do imperador
Os leques simplesmente divinais,
Pratarias e cristais,
Figuras e esculturas
De real valor assim
Enfeitiçando a imensidão
Embalando na canção
Vai o feliz trovador
Lalará, lalará, lalalará"
1968,8,Unidos de Vila Isabel Quatro séculos de modas e costumes L A,76.0,https://galeriadosamba.com.br/escolas-de-samba/unidos-de-vila-isabel/1968/,"A Vila desce colorida
Para mostrar no carnaval
Quatro séculos de modas e costumes
O moderno e o tradicional
Negros, brancos, índios
Eis a miscigenação
Ditando moda, fixando os costumes
Os rituais e a tradição
E surgem tipos brasileiros
Saveiros e bateador
O carioca e o gaúcho
Jangadeiro e cantador
 
Lá vem o negro
Vejam as mucamas
Também vem com o branco
Elegantes damas
 
Desfilam modas do Rio
Costumes do norte e a dança do sul
Capoeiras, desafios
Frevos e maracatus
 
Laiaraiá, ô, laiaraiaá
Festa da menina-moça
Na tribo dos Carajás
Candomblés lá na Bahia
Onde baixam os orixás"
1968,9,Independentes do Leblon Modas e aspectos do Rio no século XVIII L A,60.0,https://galeriadosamba.com.br/escolas-de-samba/independentes-do-leblon/1968/,"Revivemos a história tão febril
Um passado deslumbrante
Cheio de encantos mil
Foi no século XVIII
Que o Rio de Janeiro
Deu um grandioso passo
Em sua propagação
Com a edificação
Do sublime relicário
Do mais alto gabarito
Capela do Rosário
E São Benedito
E daí a cidade cresceu para se tornar
Tradicional na era colonial
Rio das congadas, este belo ritual dava
Um colorido fascinante
Nesta terra colossal
E das barrocas as elegantes
E mais ricas cariocas
O povo alegre e hospitaleiro
Das mucamas e do velho sapateiro
Rio dos vice-reis
Das mais altas personalidades
E que muito trabalharam
Em prol do desenvolvimento da cidade
Construindo lindas obras imortais
Do Rio antigo que não volta nunca mais
A verdade é, que o lucro originário desta
Crescente evolução foi o ouro e o diamante
Que os bandeirantes descobriram no sertão"
1968,10,Império da Tijuca Exaltação a Cândido Portinari L A,52.0,https://galeriadosamba.com.br/escolas-de-samba/imperio-da-tijuca/1968/,"Verdes campos da minha terra
Florescem, para inspirar...
Livre canto da minha terra
Canto forte, para exaltar
Portinari!
Do azul celestial,
A beleza pictórica do mural
Com destemor,
Retratou, sem fantasia,
Nosso diário labor
Sonhos e sobrevivência
Nos cafezais, no algododeiro,
Na pocura eterna, o garimpeiro
Pintou, com poesia,
A força que no agreste se fazia.
Nosso chorar, nosso sorrir
Na tela e gigantescos murais...
Foi o primeiro a colorir
Nossos problemas sociais!
Sertão,
Grande inspirador!
Daquele que seria
O nosso maior pintor
Morro!
Também fostes retratado,
E o moleque esfarrapado,
Que vendia alguma coisa
No tabuleiro, para ganhar o pão,
Ele pintou com emoção.
E quando a ONU o convidou
Para o painel da Sala das Nações...
Deslumbrou, na cor,
O tema profundo
Guerra e Paz no mundo
Assegurando o seu lugar,
Além de nossos corações...
É imortal na história da pintura universal!"
1969,1,Acadêmicos do Salgueiro Bahia de todos os deuses L,129.0,https://galeriadosamba.com.br/escolas-de-samba/academicos-do-salgueiro/1969/,"Bahia, os meus olhos estão brilhando, 
Meu coração palpitando 
De tanta felicidade. 
És a rainha da beleza universal, 
Minha querida Bahia, 
Muito antes do Império 
Foste a primeira capital 
Preto Velho Benedito já dizia 
Felicidade também mora na Bahia, 
Tua história, tua glória 
Teu nome é tradição, 
Bahia do velho mercado 
Subida da Conceição.
És tão rica em minerais, 
Tens cacau, tens carnaúba, 
Famoso jacarandá, 
Terra abençoada pelos deuses, 
E o petróleo a jorrar
Nega baiana, 
Tabuleiro de quindim, 
Todo dia ela está 
Na igreja do Bonfim, oi 
Na ladeira tem, tem capoeira, 
Zum, zum, zum,
Zum, zum, zum,
Capoeira mata um!"
1969,2,Estação Primeira de Mangueira Mercadores e suas tradições L A,126.0,https://galeriadosamba.com.br/escolas-de-samba/estacao-primeira-de-mangueira/1969/,"Abriu-se a cortina do passado
Neste palco iluminado
Onde tudo é carnaval
Vamos recordar
Nesta grande apoteose
Uma história triunfal
Brasil dos mercadores
Aventureiros e sonhadores
Que desbravaram o sertão
Deste imenso rincão
 
Foi tão sublime
O ideal dos pioneiros
Bandeirantes de um progresso
Soberano e altaneiro
 
Na imensidão de nossas matas
Cachoeiras e cascatas
Fontes de riqueza natural
Era extraído um tesouro
Onde imperava o ouro
E os verdes canaviais
Em Vila Rica os mercadores
Ostentavam seus brasões
Nos elegantes salões
 
Longe, ao longe então se ouvia
A suave sinfonia
Dos mascates em pregão
 
Glória a estes bravos
Que lutaram por um ideal
E conseguiram conquistar
As riquezas do Brasil colonial"
1969,3,Portela Treze naus L A S,118.0,https://galeriadosamba.com.br/escolas-de-samba/portela/1969/,"Apesar de muitos séculos passados
Jamais o povo esquecerá
Essa gloriosa página
Que hoje tornamos a exaltar
Saindo de Portugal
Trazendo sob seu comando treze naus
Com destino às Índias
Seguia Pedro Álvares Cabral
Mas ao se afastar das calmarias
Novas terras descobria
Criava assim um mundo novo
 
E glorificava um grande povo
La la la  la la la la la la la la
La la la  la la la la la la la la
 
Esse feito colossal
Fez o nobre de Belmonte, imortal
O seu sangue de aventureiro
Seu amor ao marinheiro
Ao seu rei e a Portugal
Sua bravura e coragem
Cruzando mares de estranhas regiões
 Fizeram dele herói
 
E orgulho de duas nações
 
Ao finalizar esta epopéia deslumbrante
Com imenso orgulho exaltamos
O nome desse nobre navegante
La la la  la la la la la la la la
La la la  la la la la la la la la"
1969,4,Império Serrano Heróis da liberdade L A S,113.0,https://galeriadosamba.com.br/escolas-de-samba/imperio-serrano/1969/,"Ô ô ô 
Liberdade Senhor
Passava noite, vinha dia
O sangue do negro corria
Dia a dia
De lamento em lamento
De agonia em agonia
Ele pedia 
O fim da tirania
Lá em Vila Rica
Junto ao Largo da Bica
Local da opressão
A fiel maçonaria
Com sabedoria
Deu sua decisão
Com flores e alegria veio a abolição
A independência laureando seu brasão
Ao longe, soldados e tambores
Alunos e professores
Acompanhados de clarim
Cantavam assim :
Já raiou a liberdade
A liberdade já raiou
Essa brisa que a juventude afaga
Esta chama que o ódio não apaga 
Pelo universo é a evolução 
Em sua legítima razão
Samba, oh samba 
Tem a sua primazia
Em gozar de felicidade
Samba, meu samba 
Presta esta homenagem
Aos heróis da liberdade"
1969,5,Unidos de Vila Isabel Yayá do Cais Dourados L A,105.0,https://galeriadosamba.com.br/escolas-de-samba/unidos-de-vila-isabel/1969/,"No cais dourado da velha Bahia
Onde estava o capoeira
A Yayá também se via
Juntos na feira ou na romaria
No banho de cachoeira
E também na pescaria
 
Dançavam juntos
Em todo fandango e festinha
 
E no reisado, contramestre e pastorinha
 
Cantavam laralalaialaiá
Nas festas do alto do Gantois
 
Mas loucamente a Yayá do Cais Dourado
Trocou seu amor ardente 
Por um moço requintado
E foi-se embora
Passear em barco a vela
Desfilando em carruagem
Já não era mais aquela
 
E o capoeira que era valente chorou
 
Até que um dia a mulata 
Lá no cais apareceu
Ao ver o seu capoeira
Pra ele logo correu
 
Pediu guarida
Mas o capoeira não deu
 
Desesperada saiu pelo mundo a vagar
E o capoeira ficou com seu povo a cantar
Lalaialalará ...
 
Cantavam laralalaialaiá
Nas festas do alto do Gantois"
1969,6,"Estácio de Sá Gabriela, cravo e canela L A",101.0,https://galeriadosamba.com.br/escolas-de-samba/estacio-de-sa/1969/,"Foi na Bahia
Na cidade de Ilhéus
Que surgiu um grupo de sertanejos
Fugindo da seca do sertão
Junto estava Gabriela
Maltrapilha com uma trouxa na mão
E a poeira escondendo
Todo o seu encanto e sedução
Nacib ao contratá-la não esperava
Que ela fosse tão bela
E a retirante sertaneja
Tivesse as mãos tão divinas e habilidosas
Nos saborosos quitutes da Bahia
Nacib exclamou com tanta beleza que via
Tão bela, ô tão bela
O cheiro de cravo e a cor de canela
Ele se apaixonou
E com ela se casou
Gabriela moça pobre do sertão
Gostava de cantiga de roda
E de dançar com os pé no chão
Festejava o ano novo
No salão mais rico de Ilhéus
Quando passou a ""Pastorinha""
Festejando reisado a cantar
Gabriela abandonou luxo e riqueza
Saiu correndo, pegou o estandarte e foi pular
Toda aquela gente importante
Foi para a rua com ela festejar
Mais uma vez a mulata
Demonstrando seu valor
Uniu pobres e ricos
Com a força do amor
Toda a cidade de Ilhéus
Comentava o idílio de Gabriela
Mas Nacib compreendeu
Que ela era uma flor
Nasceu para enfeitar a vida
De prazeres e de amor"
1969,7,Mocidade Independente de Padre Miguel Vida e glória de Francisco Adolfo Varnhagen L A,96.0,https://galeriadosamba.com.br/escolas-de-samba/mocidade-independente-de-padre-miguel/1969/,"São Paulo
Terra dos bandeirantes
Torrão natal de um artista
Tão brilhante
Francisco Adolfo Varnhagem
Ilustre personagem
Este vulto imortal
Exaltamos neste carnaval
 
Glória ao eminente historiador
Assim cantamos em seu louvor
Ôôôôôôôôôôô
 
Apresentamos nesta passarela
Esta história tão bela
De Visconde de Porto Seguro
Este gênio do passado
Foi honrado e agraciado
Com justas distinções
Por outras grandes nações
Obras literárias
Deste notável escritor
São lidas até hoje
Mostrando seu real valor
Existe no Largo da Glória
O busto
Deste grande brasileiro
Embelezando ainda mais
O cenário do Rio de Janeiro"
1969,8,"Imperatriz Leopoldinense Brasil, flor amorosa de três raças L A",95.0,https://galeriadosamba.com.br/escolas-de-samba/imperatriz-leopoldinense/1969/,"Vejam de um poema
Deslumbrante
Germinam fatos marcantes
Deste maravilhoso Brasil
Que a lusa prece descobria
Botão em flor crescendo um dia
Nesta mistura sutil
E assim...
Na corte os nossos ancestrais
Trescalam doces madrigais
De um verde ninho na floresta
Ouçam...
Na voz do pássaro cantor
Um canto índio de amor
Em bodas perfumando a festa
 
Venham ver
O sol dourar de novo
Esta flor
Sonora tradição de um povo
Samba de raro esplendor
 
Vejam o luxo da mulata
Pisando brilhante, ouro e prata,
A domingar
Ouçam o trio guerreiro das matas
Ecoando nas cascatas a desafiar
Ó meu Brasil, berço de uma nova era
Quando o pescador espera
Proteção de Iemanjá, rainha do mar
E na cadência febril das moendas
Batuque que vem das fazendas
Eis a lição
Dos garimpos aos canaviais
Somos todos sempre iguais
Nesta miscigenação
 
Ó meu Brasil,
Flor amorosa de três raças
És tão sublime quando passas
Na mais perfeita integração"
1969,9,Unidos de Lucas Rapsódia folclórica L A,93.0,https://galeriadosamba.com.br/escolas-de-samba/unidos-de-lucas/1969/,"Abrem-se as cortinas coloridas
Mostrando os matizes da vida
Num cenário espetacular
Lendas, flores, lindas fantasias
Contos que o poeta vem cantar
Do céu, da terra e do mar
Do sol, das noites de luar
 
Esclarecendo em alto som
Que a liberdade é o lado bom
 
Em cortejo de grande alegria
O vaqueiro anuncia a dança do boi-bumbá
O meu boi morreu, o meu boi-bumbá
Manda buscar outro, maninha lá no Ceará
 
Olê lê lê, olê lê olá lá
Maracatu é festa
Pernambuco e Ceará
 
As legendárias Amazonas e a Rainha Conhori
Guerreira de braço forte, que lutou até a morte
Na seita dos Canaraí
No Rio Grande do Sul
O lendário Negrinho do Pastoreio
Foi surrado e amarrado e jogado dentro de um formigueiro
E o Príncipe Obá, homem de grande projeção
Que lutou bravamente na guerra
Foi herói do seu batalhão
As pastorinhas com seus belos madrigais
Entoavam lindos cantos
Que hoje não se ouvem mais
 
Na Bahia tem, tem, tem
Na Bahia tem oh baiana
Água de Vintém"
1969,10,Em Cima da Hora Ouro escravo L A,90.0,https://galeriadosamba.com.br/escolas-de-samba/em-cima-da-hora/1969/,"Do homem africano ressaltamos o valor
Nestas páginas marcantes
Que o “Em Cima do Hora” desfolhou
Que apresentamos neste carnaval
O ouro escravo
No tempo do Brasil colonial
Brilha nos anais desta história
Solto no campo, na serra ou junto ao mar
Ao índio bronzeado não puderam escravizar
Enquanto o negro era martirizado
Na escavação do ouro trabalhando sem cessar
A toda crueldade resistia
Oh! quanto o negro sofria
A exploração era geral
Na mineração e também no vegetal
O pau-brasil
De um século para outro sumiu
Transformado em anilina enriquecendo o tecido
Que o colo de ricas damas cobriu
E as montanhas de esmeraldas
E as pepitas brilhantes
Aumentavam as ilusões dos aventureiros bandeirantes
E o negro trabalhava
Nesta terra importante
Tratava da plantação
Na lavoura verdejante
Ô ô ô lara, lara, lara, ra, ra, ra,
Só o homem africano era braço produtor
Que mais tarde a Lei Áurea libertou"
1970,1,Portela Lendas e mistérios da Amazônia L A S,88.0,https://galeriadosamba.com.br/escolas-de-samba/portela/1970/,"Nesta avenida colorida
A Portela faz seu carnaval
Lendas e mistérios da Amazônia
Cantamos neste samba original
Dizem que os astros se amaram
E não puderam se casar
 
A lua apaixonada chorou tanto
Que do seu pranto nasceu o rio e o mar
 
E dizem mais
Jaçanã, bela como uma flor
Certa manhã viu ser proibido o seu amor
Pois um valente guerreiro
Por ela se apaixonou
Foi sacrificada pela ira do pajé
E na vitória-régia
Ela se transformou
Quando chegava a primavera
A estação das flores
Havia uma festa de amores
Era a tradição das Amazonas
Mulheres guerreiras
Aquele ambiente de alegria
Só terminava ao raiar do dia
 
Ô esquindô lá, lá
Ô esquindô lê, lê
Olha só quem vem lá
É o saci pererê"
1970,2,"Acadêmicos do Salgueiro Praça Onze, carioca da gema L A S",83.0,https://galeriadosamba.com.br/escolas-de-samba/academicos-do-salgueiro/1970/,"És carioca da gema, 
Digna de um poema, 
Ó Praça Onze, 
Eterna capital 
Do nosso samba brasileiro, 
Tradição do carnaval. 
Nas madrugadas em festas, 
Boêmios esqueciam serestas 
Para comporem os grupos de batuqueiros 
Iluminados pela luz de candeeiros. 
Tia Ciata, 
Que era bamba pra valer, 
Não desprezava um pagode 
Antes do dia amanhecer
Oi, abre a roda, meninada,
Que o samba virou batucada
Pau pau-pereira
Pau-pereira ingratidão
Todo pau o vento leva
Só o pau-pereira não"
1970,3,Estação Primeira de Mangueira Um cântico à natureza L A,79.0,https://galeriadosamba.com.br/escolas-de-samba/estacao-primeira-de-mangueira/1970/,"Brilhou no céu o sol, oh, que beleza
Vem contemplar a natureza
Vem abrasar a imensidão, imensidão
Onde a pesca ou a plantação
Pedras preciosas e mineração
Rio, cachoeiras e cascatas
Frutos, pássaros e matas
Enobrecem a nação
Oh! Lugar, Oh! Lugar
Tudo o que se planta dá
Terra igual a essa não há 
Imenso torrão de natureza incomum
Onde envaidece qualquer um
Praias e flores
Inspiram amores
E o petróleo lhe deu mais vida
Solo de vultos imortais
Direi seu nome e não esquecerão jamais
Oh !  Pátria querida
De natureza tão sutil
Tens belezas mil
Isso é Brasil, isso é Brasil, isso é Brasil"
1970,4,Mocidade Independente de Padre Miguel O meu pé de laranja lima L A S,78.0,https://galeriadosamba.com.br/escolas-de-samba/mocidade-independente-de-padre-miguel/1970/,"Era uma vez
Frase que traz felicidade
Às pequeninas majestades
No seu reino de ilusões
Reis, fadas e rainhas
As estórias contadas pelas dindinhas
Entre outras seduções
Dominam suas imaginações
Nas inocentes travessuras
Merecem ternura e muita compreensão
No seu reino de alegria
Do seu mundo de fantasia
Não as devemos despertar
Para as tristezas enegrecidas
Dos infortúnios da vida
Oh como é triste fazer a criança chorar
Oh crianças queridas 
Alegrias coloridas 
Esperança de  toda a geração
Eis a mensagem
Continuem o espetaculo
Ao sabor dos seus corações
Ah eu entrei na roda
Eu entrei na roda-dança
Eu entrei na contra-dança
Eu não sei dançar"
1970,5,Unidos de Vila Isabel Glórias gaúchas L A,77.0,https://galeriadosamba.com.br/escolas-de-samba/unidos-de-vila-isabel/1970/,"Desfila a Vila novamente incrementada
E desta vez tem o Rio Grande na jogada
Com sua glórias e tradições
Suas histórias e seus brasões
Tem gaúcho lá nos Pampas que não é de brincadeira
Estadista de renome já nos deu este torrão
Foi rainha da beleza a farroupilha hospitaleira
É a terra da videira, do churrasco e chimarrão
 
Vamos cantar
Gentes do meridião
Caminhando pela estrada
Sem espora e sem gibão
 
Toma conta do rebanho
Negrinho do pastoreio
Sonha e canto o teu sonho
No viola o violeiro
E o gaúcho forasteiro 
Contemplando o céu azul
Até o norte brasileiro
Vai cantarolando uma canção do sul
 
Vou-me embora, vou-me embora
Prenda minha
Tenho muito que fazer
Eu vou partir para bem longe
Prenda minha
Pro campo do bem-querer"
1970,6,"Imperatriz Leopoldinense Oropa, França e Bahia L A S",74.0,https://galeriadosamba.com.br/escolas-de-samba/imperatriz-leopoldinense/1970/,"Na alvorada de glória
Da literatura brasileira
Quando um marco transformou a 
Velha história
Da arte numa nova fronteira
Dentro da semana modernista
Criou a independência cultural
Deu plena liberdade ao artista
Desprezando a tradição neste verso original
 
O rei mandou me chamar
Pra casar com sua ""fia""
O dote que ele me dava
Oropa, França e Bahia
 
Vibrante, surgiu da lenda o bandeirante
Sob a luz dos pirilampos
Perdido nos campos a procura do mar
Sem saber voltar, sem saber voltar
Macunaíma, nego sonso, feiticeiro
Cobra Norato e a rainha Luzia
São personagens do cenário brasileiro
Como a mulata, o café e o vatapá
No carnaval, o arlequim e a colombina
Linda menina, amada pelo pierrô
Parece o lamento da prece
 
A voz derradeira da porta-bandeira
morrendo de amor
 
É tempo de amar o que se amou 
Ô,ô,ô,ô,ô,ô,ô,ô,ô"
1970,7,Estácio de Sá Terra de Caruaru L A,72.0,https://galeriadosamba.com.br/escolas-de-samba/estacio-de-sa/1970/,"Em Pernambuco, na terra de Caruaru
Berço de tantas tradições
Do frevo e maracatu
Os violeiros, cancioneiros
Zabumbas, tantãs e pandeiros
Uma canção e sanfoneiros
Pregoeiros na feira
Viajantes caixeiros
Negros trabalhavam
Na colheita do algodão
Filhos de pioneiros estudavam
Para o progresso da nação
Na casa grande da fazenda
Igreja da Conceição
O requinte deste tema
O passado de glória
Na cidade moderna de Caruaru
Enriquecem nosso poema
A festa junina, o ciclo do natal
E o maracatu no carnaval
Oi, maracatu, maracatu cantarei
Oi, maracatu, maracatu gingarei"
1970,8,Império Serrano Arte em tom maior L A,65.0,https://galeriadosamba.com.br/escolas-de-samba/imperio-serrano/1970/,"Lá lá lá rá lá lá
Lá lá lá lá
Tudo isto quer dizer Brasil, Brasil
Brasil
És a natureza em festa
Até parece seresta
A passarada cantando em seu louvor
Oh meu Brasil
Glória ao colonizador
Que evolui esse torrão
O negro foi braço forte da evolução
Terra de artistas geniais
Ainda existem nos salões de belas-artes
Como testemunhas imortais
São belos nossos rios e cascatas
Terras e verdes matas
E campina multicor
É o orgulho de uma raça
Quando brilha o astro rei
Tudo é esplendor
Essa paisagem tão bela
Que cantamos nesta passarela
O velho mundo conheceu
Usos e costumes em aquarela"
1970,9,Unidos do Jacarezinho O fabuloso mundo do circo L A,50.0,https://galeriadosamba.com.br/escolas-de-samba/unidos-do-jacarezinho/1970/,"O circo chegou aqui
Vamos aplaudir
Veio lá do estrangeiro
Para o nosso solo brasileiro
Trazendo alegria a milhões de corações
Faz vibrar as multidões
Lalaia lalaia laia laia laia laia
O circo é tradição mundial
E o palhaço é a figura principal
Os trapezistas sensacionais
Os domadores desafiam os animais
E no século XX
Despontaram para a platéia brasileira
O famoso Chimarrão
Dudu e Benjamim de Oliveira
Sorria, meu povo sorria
Com Fred, Carequinha e Arrelia
Lá, lá, lá, lá"
